{
  "schema_version": "1.0.0",
  "catalog_id": "psf_field_v1_default",
  "terms": [
    {
      "term_id": "zernike_0_0",
      "name": "Piston",
      "kind": "phase",
      "scope": "per_session",
      "frozen": true,
      "enabled": true,
      "n": 0,
      "m": 0,
      "field_basis": { "family": "monomial", "degree": 0, "terms": [[0, 0]] },
      "bounds": [-5.0, 5.0],
      "init": { "method": "zero" },
      "prior": { "family": "none" },
      "units": "waves"
    },
    {
      "term_id": "zernike_1_1",
      "name": "Tilt X",
      "kind": "phase",
      "scope": "per_session",
      "frozen": true,
      "enabled": false,
      "n": 1,
      "m": 1,
      "field_basis": { "family": "monomial", "degree": 0, "terms": [[0, 0]] },
      "bounds": [-5.0, 5.0],
      "init": { "method": "zero" },
      "prior": { "family": "none" },
      "units": "waves"
    },
    {
      "term_id": "zernike_1_m1",
      "name": "Tilt Y",
      "kind": "phase",
      "scope": "per_session",
      "frozen": true,
      "enabled": false,
      "n": 1,
      "m": -1,
      "field_basis": { "family": "monomial", "degree": 0, "terms": [[0, 0]] },
      "bounds": [-5.0, 5.0],
      "init": { "method": "zero" },
      "prior": { "family": "none" },
      "units": "waves"
    },
    {
      "term_id": "zernike_2_0",
      "name": "Defocus",
      "kind": "phase",
      "scope": "per_session",
      "frozen": false,
      "enabled": true,
      "n": 2,
      "m": 0,
      "field_basis": {
        "family": "monomial",
        "degree": 2,
        "terms": [[0, 0], [1, 0], [0, 1], [2, 0], [1, 1], [0, 2]]
      },
      "bounds": [-5.0, 5.0],
      "init": { "method": "defocus_moment" },
      "prior": { "family": "none" },
      "units": "waves"
    },
    {
      "term_id": "zernike_2_2",
      "name": "Astigmatism cos",
      "kind": "phase",
      "scope": "per_session",
      "frozen": false,
      "enabled": true,
      "n": 2,
      "m": 2,
      "field_basis": { "family": "monomial", "degree": 1, "terms": [[0, 0], [1, 0], [0, 1]] },
      "bounds": [-5.0, 5.0],
      "init": { "method": "zero" },
      "prior": { "family": "none" },
      "units": "waves",
      "report": { "polar_pair": "zernike_2_m2", "scale": 1.0, "unit_label": "waves RMS" }
    },
    {
      "term_id": "zernike_2_m2",
      "name": "Astigmatism sin",
      "kind": "phase",
      "scope": "per_session",
      "frozen": false,
      "enabled": true,
      "n": 2,
      "m": -2,
      "field_basis": { "family": "monomial", "degree": 1, "terms": [[0, 0], [1, 0], [0, 1]] },
      "bounds": [-5.0, 5.0],
      "init": { "method": "zero" },
      "prior": { "family": "none" },
      "units": "waves"
    },
    {
      "term_id": "zernike_3_1",
      "name": "Primary coma cos",
      "kind": "phase",
      "scope": "per_session",
      "frozen": false,
      "enabled": true,
      "n": 3,
      "m": 1,
      "field_basis": { "family": "monomial", "degree": 1, "terms": [[0, 0], [1, 0], [0, 1]] },
      "bounds": [-5.0, 5.0],
      "init": { "method": "zero" },
      "prior": { "family": "none" },
      "units": "waves",
      "report": { "polar_pair": "zernike_3_m1", "scale": 1.0, "unit_label": "waves RMS" }
    },
    {
      "term_id": "zernike_3_m1",
      "name": "Primary coma sin",
      "kind": "phase",
      "scope": "per_session",
      "frozen": false,
      "enabled": true,
      "n": 3,
      "m": -1,
      "field_basis": { "family": "monomial", "degree": 1, "terms": [[0, 0], [1, 0], [0, 1]] },
      "bounds": [-5.0, 5.0],
      "init": { "method": "zero" },
      "prior": { "family": "none" },
      "units": "waves"
    },
    {
      "term_id": "zernike_3_3",
      "name": "Trefoil cos",
      "kind": "phase",
      "scope": "per_session",
      "frozen": false,
      "enabled": true,
      "n": 3,
      "m": 3,
      "field_basis": { "family": "monomial", "degree": 0, "terms": [[0, 0]] },
      "bounds": [-5.0, 5.0],
      "init": { "method": "zero" },
      "prior": { "family": "none" },
      "units": "waves",
      "report": { "polar_pair": "zernike_3_m3", "scale": 1.0, "unit_label": "waves RMS" }
    },
    {
      "term_id": "zernike_3_m3",
      "name": "Trefoil sin",
      "kind": "phase",
      "scope": "per_session",
      "frozen": false,
      "enabled": true,
      "n": 3,
      "m": -3,
      "field_basis": { "family": "monomial", "degree": 0, "terms": [[0, 0]] },
      "bounds": [-5.0, 5.0],
      "init": { "method": "zero" },
      "prior": { "family": "none" },
      "units": "waves"
    },
    {
      "term_id": "zernike_4_0",
      "name": "Primary spherical",
      "kind": "phase",
      "scope": "per_session",
      "frozen": false,
      "enabled": true,
      "n": 4,
      "m": 0,
      "field_basis": { "family": "monomial", "degree": 0, "terms": [[0, 0]] },
      "bounds": [-5.0, 5.0],
      "init": { "method": "zero" },
      "prior": { "family": "none" },
      "units": "waves"
    },
    {
      "term_id": "zernike_4_2",
      "name": "Secondary astigmatism cos",
      "kind": "phase",
      "scope": "per_session",
      "frozen": false,
      "enabled": true,
      "n": 4,
      "m": 2,
      "field_basis": { "family": "monomial", "degree": 0, "terms": [[0, 0]] },
      "bounds": [-5.0, 5.0],
      "init": { "method": "zero" },
      "prior": { "family": "none" },
      "units": "waves",
      "report": { "polar_pair": "zernike_4_m2", "scale": 1.0, "unit_label": "waves RMS" }
    },
    {
      "term_id": "zernike_4_m2",
      "name": "Secondary astigmatism sin",
      "kind": "phase",
      "scope": "per_session",
      "frozen": false,
      "enabled": true,
      "n": 4,
      "m": -2,
      "field_basis": { "family": "monomial", "degree": 0, "terms": [[0, 0]] },
      "bounds": [-5.0, 5.0],
      "init": { "method": "zero" },
      "prior": { "family": "none" },
      "units": "waves"
    },
    {
      "term_id": "flux",
      "name": "Flux",
      "kind": "photometric",
      "scope": "per_star",
      "frozen": false,
      "enabled": true,
      "bounds": [0.0, 1e12],
      "init": { "method": "flux_sum" },
      "prior": { "family": "none" },
      "units": "ADU"
    },
    {
      "term_id": "sky",
      "name": "Residual sky",
      "kind": "photometric",
      "scope": "per_star",
      "frozen": true,
      "enabled": true,
      "bounds": [-1000.0, 1000.0],
      "init": { "method": "zero" },
      "prior": { "family": "none" },
      "units": "ADU"
    },
    {
      "term_id": "moffat_seeing",
      "name": "Moffat seeing",
      "kind": "kernel",
      "scope": "per_exposure",
      "frozen": false,
      "enabled": true,
      "kernel": { "id": "moffat_iso" },
      "field_basis": { "family": "monomial", "degree": 0, "terms": [[0, 0]] },
      "bounds": [0.0, 20.0],
      "init": { "method": "moffat_fwhm" },
      "prior": { "family": "gaussian", "mean": 1.0, "sigma": 0.5 },
      "units": "px"
    },
    {
      "term_id": "gaussian_jitter",
      "name": "Isotropic jitter",
      "kind": "kernel",
      "scope": "per_exposure",
      "frozen": false,
      "enabled": true,
      "kernel": { "id": "gaussian_iso" },
      "field_basis": { "family": "monomial", "degree": 0, "terms": [[0, 0]] },
      "bounds": [0.0, 20.0],
      "init": { "method": "zero" },
      "prior": { "family": "gaussian", "mean": 0.1, "sigma": 0.3 },
      "units": "px"
    },
    {
      "term_id": "charge_diffusion",
      "name": "Charge diffusion",
      "kind": "kernel",
      "scope": "per_session",
      "frozen": false,
      "enabled": true,
      "kernel": { "id": "gaussian_iso" },
      "field_basis": { "family": "monomial", "degree": 0, "terms": [[0, 0]] },
      "bounds": [0.0, 20.0],
      "init": { "method": "zero" },
      "prior": { "family": "gaussian", "mean": 0.3, "sigma": 0.1 },
      "units": "px"
    },
    {
      "term_id": "linear_drift",
      "name": "Linear drift",
      "kind": "kernel",
      "scope": "per_exposure",
      "frozen": true,
      "enabled": false,
      "kernel": { "id": "linear_drift" },
      "field_basis": { "family": "monomial", "degree": 0, "terms": [[0, 0]] },
      "bounds": [0.0, 20.0],
      "init": { "method": "zero" },
      "prior": { "family": "none" },
      "units": "px"
    },
    {
      "term_id": "field_rotation",
      "name": "Field rotation",
      "kind": "kernel",
      "scope": "per_exposure",
      "frozen": true,
      "enabled": false,
      "kernel": { "id": "field_rotation" },
      "bounds": null,
      "init": { "method": "zero" },
      "prior": { "family": "none" },
      "units": "rad/s"
    },
    {
      "term_id": "periodic_error",
      "name": "Periodic error",
      "kind": "kernel",
      "scope": "per_exposure",
      "frozen": true,
      "enabled": false,
      "kernel": { "id": "periodic_error" },
      "field_basis": { "family": "monomial", "degree": 0, "terms": [[0, 0]] },
      "bounds": [0.0, 20.0],
      "init": { "method": "zero" },
      "prior": { "family": "none" },
      "units": "px"
    }
  ],
  "bundles": [
    {
      "bundle_id": "collimation",
      "name": "Collimation (unpopulated)",
      "term_ids": [
        "zernike_3_1",
        "zernike_3_m1",
        "zernike_2_2",
        "zernike_2_m2",
        "zernike_2_0"
      ],
      "matrix": null
    }
  ],
  "fit_schedule": [
    {
      "name": "coarse",
      "unfrozen_term_ids": [
        "flux",
        "zernike_2_0",
        "zernike_2_2",
        "zernike_2_m2",
        "moffat_seeing"
      ]
    },
    {
      "name": "mid",
      "unfrozen_term_ids": [
        "flux",
        "zernike_2_0",
        "zernike_2_2",
        "zernike_2_m2",
        "zernike_3_1",
        "zernike_3_m1",
        "zernike_3_3",
        "zernike_3_m3",
        "moffat_seeing",
        "gaussian_jitter"
      ]
    },
    {
      "name": "full",
      "unfrozen_term_ids": [
        "flux",
        "zernike_2_0",
        "zernike_2_2",
        "zernike_2_m2",
        "zernike_3_1",